{
  "schema_version": "1.0.0",
  "rpeep_id": "0bb1e0d7-6f8e-4d6f-8f33-2b3a4c5d6e7f",
  "resident_profile": {
    "schema_version": "1.0.0",
    "person_id": "6e0a94a4-2b2a-4d49-9d8e-3b19a2f2f9c1",
    "name": { "given": "Alex", "family": "Taylor" }
  },
  "residence_location": {
    "schema_version": "1.0.0",
    "thoroughfare": "12 Market Street",
    "town": "Exampleton",
    "postcode": "EC1A 1AA",
    "country_code": "GB",
    "internal_location": { "building_id": "BLDG-001", "level": "4", "area": "Flat 4B" }
  },
  "consent": {
    "schema_version": "1.0.0",
    "consent_id": "8e0b2e65-78f1-4a8a-9b8d-111111111111",
    "subject_id": "6e0a94a4-2b2a-4d49-9d8e-3b19a2f2f9c1",
    "status": "given",
    "scope": ["RPEEP", "EES"],
    "method": "written",
    "actor": { "name": "Alex Taylor", "role": "Resident" },
    "recorded_at": "2025-08-12T10:30:00Z"
  },
  "person_ees": {
    "target_person_id": "6e0a94a4-2b2a-4d49-9d8e-3b19a2f2f9c1",
    "plain_language_instructions": "If the alarm sounds and your corridor is clear, go to Stair A with your buddy. Use the evac chair with trained staff.",
    "assistance_required": ["Buddy support", "Evac chair (2 staff)"],
    "equipment": ["Evac Chair EC-01"],
    "contact_on_alarm": { "who": "Concierge", "how": "Phone 100 (internal)" }
  },
  "distribution": [
    { "recipient_role": "resident", "delivery_method": "portal", "timestamp": "2025-08-12T10:35:00Z" },
    { "recipient_role": "managing_agent", "delivery_method": "email", "timestamp": "2025-08-12T10:36:00Z" }
  ],
  "references": {
    "peep_id": "b7a9e682-d4e8-4a7f-9f0d-2f5d2e8c9a77",
    "pcfra_id": "3a5d1a56-3d8c-4c34-8e68-0d4c2b3b7f01",
    "building_statement_ees_id": "a8fd2c73-2ea4-4aee-b5e1-e7f4d2c879a1"
  },
  "review": {
    "schema_version": "1.0.0",
    "status": "approved",
    "version": "1.0.0",
    "created_by": "Morgan Smith",
    "created_at": "2025-08-12T10:40:00Z",
    "next_review_due": "2026-08-12"
  }
}